[
  { "t": "第1章 私権の主体", "p": 10, "page_start": 10, "depth": 1, "l": 1, "toc_node_id": "alo:book:isbn:9784335357526:toc:001", "parent_toc_node_id": "", "toc_path_id": "c01", "toc_source": "openbd", "toc_status": "structured" },
  { "t": "第6章 時効", "p": 290, "page_start": 290, "depth": 1, "l": 1, "toc_node_id": "alo:book:isbn:9784335357526:toc:002", "parent_toc_node_id": "", "toc_path_id": "c06", "toc_source": "openbd", "toc_status": "structured" },
  { "t": "第1節 時効総説", "p": 291, "page_start": 291, "depth": 2, "l": 2, "toc_node_id": "alo:book:isbn:9784335357526:toc:003", "parent_toc_node_id": "alo:book:isbn:9784335357526:toc:002", "toc_path_id": "c06.s01", "toc_source": "openbd", "toc_status": "structured" },
  { "t": "第2節 取得時効", "p": 300, "page_start": 300, "depth": 2, "l": 2, "toc_node_id": "alo:book:isbn:9784335357526:toc:004", "parent_toc_node_id": "alo:book:isbn:9784335357526:toc:002", "toc_path_id": "c06.s02", "toc_source": "openbd", "toc_status": "structured" },
  { "t": "第3節 消滅時効とその起算点", "p": 315, "page_start": 315, "depth": 2, "l": 2, "toc_node_id": "alo:book:isbn:9784335357526:toc:005", "parent_toc_node_id": "alo:book:isbn:9784335357526:toc:002", "toc_path_id": "c06.s03", "toc_source": "openbd", "toc_status": "structured" }
]
