[
  { "t": "第1編 時効総論", "p": 3, "page_start": 3, "depth": 1, "l": 1, "toc_node_id": "alo:book:isbn:9784788287654:toc:001", "parent_toc_node_id": "", "toc_path_id": "p01", "toc_source": "toc_pdf", "toc_status": "structured" },
  { "t": "第2編 消滅時効の起算点", "p": 45, "page_start": 45, "depth": 1, "l": 1, "toc_node_id": "alo:book:isbn:9784788287654:toc:002", "parent_toc_node_id": "", "toc_path_id": "p02", "toc_source": "toc_pdf", "toc_status": "structured" },
  { "t": "第1章 起算点に関する基本的な考え方", "p": 46, "page_start": 46, "depth": 2, "l": 2, "toc_node_id": "alo:book:isbn:9784788287654:toc:003", "parent_toc_node_id": "alo:book:isbn:9784788287654:toc:002", "toc_path_id": "p02.c01", "toc_source": "toc_pdf", "toc_status": "structured" },
  { "t": "第2章 各種債権の時効の起算点", "p": 78, "page_start": 78, "depth": 2, "l": 2, "toc_node_id": "alo:book:isbn:9784788287654:toc:004", "parent_toc_node_id": "alo:book:isbn:9784788287654:toc:002", "toc_path_id": "p02.c02", "toc_source": "toc_pdf", "toc_status": "structured" },
  { "t": "第1節 安全配慮義務違反による損害賠償請求権", "p": 92, "page_start": 92, "depth": 3, "l": 3, "toc_node_id": "alo:book:isbn:9784788287654:toc:005", "parent_toc_node_id": "alo:book:isbn:9784788287654:toc:004", "toc_path_id": "p02.c02.s01", "toc_source": "toc_pdf", "toc_status": "structured" },
  { "t": "第3編 時効の援用と放棄", "p": 160, "page_start": 160, "depth": 1, "l": 1, "toc_node_id": "alo:book:isbn:9784788287654:toc:006", "parent_toc_node_id": "", "toc_path_id": "p03", "toc_source": "toc_pdf", "toc_status": "structured" }
]
